{
  "$schema": "https://json-schema.org/draft/2020-12/schema",
  "title": "dag.json",
  "type": "object",
  "required": ["meta", "nodes", "edges", "metrics", "analysis"],
  "properties": {
    "meta": {
      "type": "object",
      "required": ["version", "artifactHash", "tasksHash"],
      "properties": {
        "version": {"type": "string"},
        "artifactHash": {"type": "string"},
        "tasksHash": {"type": "string"}
      }
    },
    "nodes": {
      "type": "array",
      "minItems": 1,
      "items": {
        "type": "object",
        "required": ["id", "depth", "criticalPath", "parallelOpportunity"],
        "properties": {
          "id": {"type": "string"},
          "depth": {"type": "integer", "minimum": 0},
          "criticalPath": {"type": "boolean"},
          "parallelOpportunity": {"type": "integer", "minimum": 0}
        },
        "additionalProperties": false
      }
    },
    "edges": {
      "type": "array",
      "items": {
        "type": "object",
        "required": ["from", "to", "type", "transitive"],
        "properties": {
          "from": {"type": "string"},
          "to": {"type": "string"},
          "type": {"type": "string"},
          "transitive": {"type": "boolean"}
        },
        "additionalProperties": false
      }
    },
    "metrics": {
      "type": "object",
      "properties": {
        "minConfidenceApplied": {"type":"number"},
        "keptByType": {"type":"object", "additionalProperties": {"type":"integer"}},
        "droppedByType": {"type":"object", "additionalProperties": {"type":"integer"}},
        "nodes": {"type":"integer"},
        "edges": {"type":"integer"},
        "edgeDensity": {"type":"number"},
        "widthApprox": {"type":"integer"},
        "longestPathLength": {"type":"integer"},
        "criticalPath": {"type":"array", "items": {"type":"string"}},
        "isolatedTasks": {"type":"integer"},
        "verbFirstPct": {"type":"number"},
        "evidenceCoverage": {"type":"number"}
      },
      "additionalProperties": false
    },
    "analysis": {
      "type": "object",
      "required": ["ok"],
      "properties": {"ok": {"type": "boolean"}}
    }
  }
}
