{
  "analysis": {
    "errors": null,
    "ok": true,
    "softDeps": null,
    "warnings": null
  },
  "edges": [
    {
      "from": "T001",
      "to": "T002",
      "transitive": false,
      "type": "sequential"
    },
    {
      "from": "T002",
      "to": "T003",
      "transitive": false,
      "type": "technical"
    }
  ],
  "meta": {
    "artifactHash": "efed14ac173ba48dcc6b3f4ab0f626ee5ea32868d36d2475478c2fc1fbf62752",
    "tasksHash": "1d7d32fc9d018bf764226f8ce71399a548be8711b7aa9c69d6b2cf89e76b2f09",
    "version": "v8"
  },
  "metrics": {
    "criticalPath": [
      "T001",
      "T002",
      "T003"
    ],
    "droppedByType": {},
    "edgeDensity": 0,
    "edges": 2,
    "evidenceCoverage": 0,
    "isolatedTasks": 0,
    "keptByType": {
      "sequential": 1,
      "technical": 1
    },
    "longestPathLength": 3,
    "minConfidenceApplied": 0.7,
    "nodes": 3,
    "verbFirstPct": 0,
    "widthApprox": 1
  },
  "nodes": [
    {
      "criticalPath": true,
      "depth": 0,
      "id": "T001",
      "parallelOpportunity": 1
    },
    {
      "criticalPath": true,
      "depth": 1,
      "id": "T002",
      "parallelOpportunity": 1
    },
    {
      "criticalPath": true,
      "depth": 2,
      "id": "T003",
      "parallelOpportunity": 1
    }
  ]
}
